,logical_fallacies,label,articles,Claim,Implication,Referring Expressions - Claim,Referring Expressions - Implication,Property Implications,Equal Entities,Subset Entities,Claim Lfs,Implication Lfs,Logical Form,Logical Form 2,result
80,appeal to emotion,0,"He said that he and his students cried when he showed them maps of the damage , which he had calculated in part by flying low in small planes and helicopters .", He and his students cried when he showed them maps of the damage.  , He calculated the damage partially by flying low in small planes and helicopters.,"IsStudentOf(c, a),  Cried(a),  Cried(c),  ShowedMaps(a, c, d),  DepictDamage(d, b)","CalculatedDamage(a, b),  FlewLow(a, e),  FlewLow(a, f),  IsSmall(e),  IsSmall(f)",[],"[(' He', ' He'), (' damage', ' damage')]",[],"Cried(a) and Cried(c) and IsStudentOf(c, a) and ShowedMaps(a, c, d) and DepictDamage(d, b)","CalculatedDamage(a, b) and FlewLow(a, e) and FlewLow(a, f) and IsSmall(e) and IsSmall(f)","(Cried(a) and Cried(c) and IsStudentOf(c, a) and ShowedMaps(a, c, d) and DepictDamage(d, b)) -> (CalculatedDamage(a, b) and FlewLow(a, e) and FlewLow(a, f) and IsSmall(e) and IsSmall(f))","(exists a (exists c (exists d (exists b (Cried(a) and Cried(c) and IsStudentOf(c, a) and ShowedMaps(a, c, d) and DepictDamage(d, b)))))) -> (exists a (exists f (exists e (exists b (CalculatedDamage(a, b) and FlewLow(a, e) and FlewLow(a, f) and IsSmall(e) and IsSmall(f))))))",LF
81,intentional,0,"On our current trajectory , the report warns , “ planetary and human systems [ are ] reaching a ‘ point of no return ’ by mid-century , in which the prospect of a largely uninhabitable Earth leads to the breakdown of nations and the international order . ”", Planetary and human systems are reaching a 'point of no return' by mid-century., Earth will become largely uninhabitable leading to the breakdown of nations and the international order.,"AreReaching(a, b)","BecomeUninhabitable(d),  LeadToBreakdown(e),  LeadToBreakdown(f)",[],[],[],"AreReaching(a, b)",BecomeUninhabitable(d) and (LeadToBreakdown(e) and LeadToBreakdown(f)),"(AreReaching(a, b)) -> (BecomeUninhabitable(d) and (LeadToBreakdown(e) and LeadToBreakdown(f)))","(exists a (exists b (AreReaching(a, b)))) -> (exists e (exists f (exists d (BecomeUninhabitable(d) and (LeadToBreakdown(e) and LeadToBreakdown(f))))))",LF
82,faulty generalization,0,A harrowing scenario analysis of how human civilization might collapse in coming decades due to climate change has been endorsed by a former Australian defense chief and senior royal navy commander ., A former Australian defense chief and senior royal navy commander endorsed a harrowing scenario analysis of how human civilization might collapse in coming decades due to climate change., Human civilization might collapse in coming decades due to climate change.,"Endorsed(d,f),  Endorsed(e,f),  MightCollapse(a),  InComingDecades(b),  DueToClimateChange(c)","MightCollapse(a),  InComingDecades(b),  DueToClimateChange(c)","[('  MightCollapse(a)', '  DueToClimateChange(c)'), ('  InComingDecades(b)', '  DueToClimateChange(c)'), ('  DueToClimateChange(c)', '  InComingDecades(b)'), ('MightCollapse(a)', '  DueToClimateChange(c)'), ('  DueToClimateChange(c)', '  InComingDecades(b)'), ('  InComingDecades(b)', '  DueToClimateChange(c)')]","[(' human civilization', ' Human civilization'), (' coming decades', ' coming decades'), (' climate change', ' climate change')]",[],"Endorsed(d,f) and Endorsed(e,f) and (MightCollapse(a) and InComingDecades(b) and DueToClimateChange(c))",MightCollapse(a) and InComingDecades(b) and DueToClimateChange(c),"(Endorsed(d,f) and Endorsed(e,f) and (MightCollapse(a) and InComingDecades(b) and DueToClimateChange(c)) & (forall a (forall c (  MightCollapse(a) ->   DueToClimateChange(c)))) & (forall c (forall b (  InComingDecades(b) ->   DueToClimateChange(c)))) & (forall c (forall b (  DueToClimateChange(c) ->   InComingDecades(b)))) & (forall a (forall c (MightCollapse(a) ->   DueToClimateChange(c)))) & (forall c (forall b (  DueToClimateChange(c) ->   InComingDecades(b)))) & (forall c (forall b (  InComingDecades(b) ->   DueToClimateChange(c))))) -> (MightCollapse(a) and InComingDecades(b) and DueToClimateChange(c))","(exists c (exists b (exists e (exists f (exists a (exists d (Endorsed(d,f) and Endorsed(e,f) and (MightCollapse(a) and InComingDecades(b) and DueToClimateChange(c)))))))) & (forall i (forall h (  MightCollapse(h) ->   DueToClimateChange(i)))) & (forall j (forall k (  InComingDecades(j) ->   DueToClimateChange(k)))) & (forall l (forall m (  DueToClimateChange(l) ->   InComingDecades(m)))) & (forall o (forall n (MightCollapse(n) ->   DueToClimateChange(o)))) & (forall p (forall q (  DueToClimateChange(p) ->   InComingDecades(q)))) & (forall r (forall s (  InComingDecades(r) ->   DueToClimateChange(s))))) -> (exists a (exists c (exists b (MightCollapse(a) and InComingDecades(b) and DueToClimateChange(c)))))",Valid
83,fallacy of extension,0,Alarmist attempts to frame thriving forests as harmful perfectly illustrate the alarmists ’ proclivity to claim anything and everything – no matter how beneficial – is severely harmful and caused by global warming ., Alarmists claim thriving forests are harmful and caused by global warming., Alarmists have a tendency to claim everything is harmful.,"ClaimHarmful(a, b),  CausedBy(b, c)","ClaimHarmful(a, d)",[],"[(' Alarmists', ' Alarmists')]","[(' thriving forests', ' everything'), (' global warming', ' everything')]","ClaimHarmful(a, b) and CausedBy(b, c)","ClaimHarmful(a, d)","(exists c (exists b (ClaimHarmful(a, b) and CausedBy(b, c)))) -> (forall d (ClaimHarmful(a, d)))","(exists a (exists c (exists b (ClaimHarmful(a, b) and CausedBy(b, c))))) -> (exists a (exists d (ClaimHarmful(a, d))))",Valid
84,ad populum,0,"The Chinese “ airpocalypse ” of 2013 peaked at what would have been an Air Quality Index of over 800 . That year , smog was responsible for a third of all deaths in the country .", Smog was responsible for a third of all deaths in China in 2013., The air quality in China was extremely poor in 2013.,"IsResponsibleFor(c, d),  OccursIn(d, a),  OccursIn(d, b)","IsIn(e, a),  IsIn(e, b),  IsExtremelyPoor(e)",[],"[(' China', ' China'), (' 2013', ' 2013')]",[],"IsResponsibleFor(c, d) and OccursIn(d, a) and OccursIn(d, b)","IsIn(e, a) and IsIn(e, b) and IsExtremelyPoor(e)","(IsResponsibleFor(c, d) and OccursIn(d, a) and OccursIn(d, b)) -> (IsIn(e, a) and IsIn(e, b) and IsExtremelyPoor(e))","(exists a (exists c (exists d (exists b (IsResponsibleFor(c, d) and OccursIn(d, a) and OccursIn(d, b)))))) -> (exists e (exists a (exists b (IsIn(e, a) and IsIn(e, b) and IsExtremelyPoor(e)))))",LF
85,ad hominem,0,"Update Jan. 25 , 2016 : As I predicted in this article , global warming activists have indeed made a full-blown public relations effort to claim 2015 was the warmest year on record .", Global warming activists have made a public relations effort to claim 2015 was the warmest year on record., 2015 was not the warmest year on record.,"MadePublicRelationsEffort(b, c),  IsClaimed(c, d),  IsWarmestYear(a, d),  IsOnRecord(d, e)","IsNotWarmestYearOnRecord(a, f)",[],"[(' 2015', ' 2015')]","[(' the warmest year', ' the warmest year on record'), (' record', ' the warmest year on record')]","MadePublicRelationsEffort(b, c) and IsClaimed(c, d) and IsWarmestYear(a, d) and IsOnRecord(d, e)","IsNotWarmestYearOnRecord(a, f)","(exists e (exists d (MadePublicRelationsEffort(b, c) and IsClaimed(c, d) and IsWarmestYear(a, d) and IsOnRecord(d, e)))) -> (forall f (IsNotWarmestYearOnRecord(a, f)))","(exists c (exists b (exists e (exists a (exists d (MadePublicRelationsEffort(b, c) and IsClaimed(c, d) and IsWarmestYear(a, d) and IsOnRecord(d, e))))))) -> (exists a (exists f (IsNotWarmestYearOnRecord(a, f))))",LF
86,fallacy of extension,0,"Global warming alarmism provides them , more than any other issue , with the things they
most want : For politicians it ’ s money and power . For environmentalists it ’ s money for their
organizations and confirmation of their near religious devotion to the idea that man is a
destructive force acting upon nature . And for the media it ’ s ideology , money , and headlines ."," Global warming alarmism provides politicians with money and power, provides environmentalists with money and confirmation of their beliefs, and provides the media with ideology, money, and headlines."," Global warming alarmism benefits politicians, environmentalists, and the media.","ProvidesWith(a, b, e),  ProvidesWith(a, b, f),  ProvidesWith(a, c, e),  ProvidesWith(a, c, g),  ProvidesWith(a, d, h),  ProvidesWith(a, d, e),  ProvidesWith(a, d, i)","Benefits(a, b),  Benefits(a, c),  Benefits(a, d)","[('ProvidesWith(a, b, e)', 'Benefits(a, b)'), ('Benefits(a, b)', 'ProvidesWith(a, b, e)'), ('  ProvidesWith(a, b, f)', 'Benefits(a, b)'), ('Benefits(a, b)', '  ProvidesWith(a, b, f)'), ('  ProvidesWith(a, b, f)', '  Benefits(a, c)'), ('  ProvidesWith(a, c, e)', 'Benefits(a, b)'), ('  ProvidesWith(a, c, e)', '  Benefits(a, c)'), ('  Benefits(a, c)', '  ProvidesWith(a, c, e)'), ('  ProvidesWith(a, c, e)', '  Benefits(a, d)'), ('  ProvidesWith(a, c, g)', 'Benefits(a, b)'), ('  ProvidesWith(a, c, g)', '  Benefits(a, c)'), ('  Benefits(a, c)', '  ProvidesWith(a, c, g)'), ('  ProvidesWith(a, d, h)', 'Benefits(a, b)'), ('  ProvidesWith(a, d, h)', '  Benefits(a, c)'), ('  ProvidesWith(a, d, h)', '  Benefits(a, d)'), ('  ProvidesWith(a, d, e)', 'Benefits(a, b)'), ('  ProvidesWith(a, d, e)', '  Benefits(a, c)'), ('  ProvidesWith(a, d, e)', '  Benefits(a, d)'), ('  Benefits(a, d)', '  ProvidesWith(a, d, e)'), ('  ProvidesWith(a, d, i)', 'Benefits(a, b)'), ('  ProvidesWith(a, d, i)', '  Benefits(a, c)'), ('  ProvidesWith(a, d, i)', '  Benefits(a, d)')]","[(' Global warming alarmism', ' Global warming alarmism'), (' politicians', ' politicians'), (' environmentalists', ' environmentalists'), (' media', ' the media')]","[(' ideology', ' Global warming alarmism'), (' headlines.', ' the media')]","ProvidesWith(a, b, e) and ProvidesWith(a, b, f) and ProvidesWith(a, c, e) and ProvidesWith(a, c, g) and ProvidesWith(a, d, h) and ProvidesWith(a, d, e) and ProvidesWith(a, d, i)","Benefits(a, b) and Benefits(a, c) and Benefits(a, d)","(exists i (exists h (ProvidesWith(a, b, e) and ProvidesWith(a, b, f) and ProvidesWith(a, c, e) and ProvidesWith(a, c, g) and ProvidesWith(a, d, h) and ProvidesWith(a, d, e) and ProvidesWith(a, d, i))) & (forall a (forall e (forall b (ProvidesWith(a, b, e) -> Benefits(a, b))))) & (forall a (forall e (forall b (Benefits(a, b) -> ProvidesWith(a, b, e))))) & (forall a (forall f (forall b (  ProvidesWith(a, b, f) -> Benefits(a, b))))) & (forall a (forall f (forall b (Benefits(a, b) ->   ProvidesWith(a, b, f))))) & (forall a (forall f (forall c (forall b (  ProvidesWith(a, b, f) ->   Benefits(a, c)))))) & (forall a (forall c (forall e (forall b (  ProvidesWith(a, c, e) -> Benefits(a, b)))))) & (forall a (forall c (forall e (  ProvidesWith(a, c, e) ->   Benefits(a, c))))) & (forall a (forall c (forall e (  Benefits(a, c) ->   ProvidesWith(a, c, e))))) & (forall a (forall d (forall c (forall e (  ProvidesWith(a, c, e) ->   Benefits(a, d)))))) & (forall a (forall c (forall g (forall b (  ProvidesWith(a, c, g) -> Benefits(a, b)))))) & (forall a (forall c (forall g (  ProvidesWith(a, c, g) ->   Benefits(a, c))))) & (forall a (forall c (forall g (  Benefits(a, c) ->   ProvidesWith(a, c, g))))) & (forall a (forall b (forall d (forall h (  ProvidesWith(a, d, h) -> Benefits(a, b)))))) & (forall a (forall c (forall d (forall h (  ProvidesWith(a, d, h) ->   Benefits(a, c)))))) & (forall a (forall d (forall h (  ProvidesWith(a, d, h) ->   Benefits(a, d))))) & (forall e (forall a (forall d (forall b (  ProvidesWith(a, d, e) -> Benefits(a, b)))))) & (forall e (forall a (forall c (forall d (  ProvidesWith(a, d, e) ->   Benefits(a, c)))))) & (forall e (forall a (forall d (  ProvidesWith(a, d, e) ->   Benefits(a, d))))) & (forall e (forall a (forall d (  Benefits(a, d) ->   ProvidesWith(a, d, e))))) & (forall i (forall a (forall d (forall b (  ProvidesWith(a, d, i) -> Benefits(a, b)))))) & (forall i (forall a (forall c (forall d (  ProvidesWith(a, d, i) ->   Benefits(a, c)))))) & (forall i (forall a (forall d (  ProvidesWith(a, d, i) ->   Benefits(a, d)))))) -> (forall d (forall a (Benefits(a, b) and Benefits(a, c) and Benefits(a, d))))","(exists i (exists c (exists b (exists e (exists f (exists g (exists h (exists a (exists d (ProvidesWith(a, b, e) and ProvidesWith(a, b, f) and ProvidesWith(a, c, e) and ProvidesWith(a, c, g) and ProvidesWith(a, d, h) and ProvidesWith(a, d, e) and ProvidesWith(a, d, i)))))))))) & (forall l (forall k (forall m (ProvidesWith(k,l,m) -> Benefits(k,l))))) & (forall p (forall o (forall n (Benefits(n,o) -> ProvidesWith(n,o,p))))) & (forall r (forall q (forall s (  ProvidesWith(q,r,s) -> Benefits(q,r))))) & (forall u (forall v (forall t (Benefits(t,u) ->   ProvidesWith(t,u,v))))) & (forall z (forall x (forall y (forall w (  ProvidesWith(w,x,y) ->   Benefits(w,z)))))) & (  ProvidesWith({,|,}) -> Benefits({,~)) & (  ProvidesWith(,,) ->   Benefits(,)) & (  Benefits(,) ->   ProvidesWith(,,)) & (  ProvidesWith(,,) ->   Benefits(,)) & (  ProvidesWith(,,) -> Benefits(,)) & (  ProvidesWith(,,) ->   Benefits(,)) & (  Benefits(,) ->   ProvidesWith(,,)) & (  ProvidesWith(,,) -> Benefits(,)) & (  ProvidesWith(,,) ->   Benefits(,)) & (  ProvidesWith(,,) ->   Benefits(,)) & (  ProvidesWith(,, ) -> Benefits(,¡)) & (  ProvidesWith(¢,£,¤) ->   Benefits(¢,¥)) & (  ProvidesWith(¦,§,¨) ->   Benefits(¦,§)) & (  Benefits(©,ª) ->   ProvidesWith(©,ª,«)) & (  ProvidesWith(¬,­,®) -> Benefits(¬,¯)) & (  ProvidesWith(°,±,²) ->   Benefits(°,³)) & (  ProvidesWith(´,µ,¶) ->   Benefits(´,µ))) -> (exists a (exists c (exists d (exists b (Benefits(a, b) and Benefits(a, c) and Benefits(a, d))))))",
87,fallacy of logic,0,"As long as the ice-water mix is well-stirred ( like a glass of ice water ) , the surface temperature stays at the freezing point until all the ice melts .", The surface temperature of a well-stirred ice-water mix stays at the freezing point until all the ice melts., The temperature of a well-stirred ice-water mix does not change until all the ice melts.,"IsWellStirred(a),  IsAtFreezingPoint(c),  Melts(b)","IsWellStirred(a),  Melts(b)","[('  Melts(b)', '  IsAtFreezingPoint(c)')]","[(' well-stirred ice-water mix', ' well-stirred ice-water mix'), (' ice.', ' ice')]","[(' Surface temperature', ' Temperature'), (' freezing point', ' Temperature'), (' ice.', ' well-stirred ice-water mix')]",IsWellStirred(a) and (Melts(b) and IsAtFreezingPoint(c)),IsWellStirred(a) and ~Melts(b),(exists b (IsWellStirred(a) and (Melts(b) and IsAtFreezingPoint(c))) & (forall c (forall b (  Melts(b) ->   IsAtFreezingPoint(c))))) -> (exists b (forall a (IsWellStirred(a) and ~Melts(b)))),(exists a (exists c (exists b (IsWellStirred(a) and (Melts(b) and IsAtFreezingPoint(c))))) & (forall h (forall g (  Melts(g) ->   IsAtFreezingPoint(h))))) -> (exists a (exists b (IsWellStirred(a) and ~Melts(b)))),LF
88,faulty generalization,0,The sea has crept up to the point that a high tide and a brisk wind are all it takes to send water pouring into streets and homes ., The sea has crept up to the point that a high tide and a brisk wind send water pouring into streets and homes.  , Water will pour into streets and homes.,"HasCreptUp(c),  IsHighTide(d),  IsBriskWind(e),  SendsWater(f, a),  SendsWater(f, b)","PoursInto(a),  PoursInto(b)","[('PoursInto(a)', '  SendsWater(f, a)'), ('  PoursInto(b)', '  SendsWater(f, a)'), ('PoursInto(a)', '  SendsWater(f, b)'), ('  PoursInto(b)', '  SendsWater(f, b)')]","[(' streets', ' Streets'), (' homes', ' homes')]",[],"HasCreptUp(c) and (IsHighTide(d) and IsBriskWind(e) and (SendsWater(f,a) and SendsWater(f,b)))",PoursInto(a) and PoursInto(b),"(HasCreptUp(c) and (IsHighTide(d) and IsBriskWind(e) and (SendsWater(f,a) and SendsWater(f,b))) & (forall a (forall f (PoursInto(a) ->   SendsWater(f, a)))) & (forall a (forall f (forall b (  PoursInto(b) ->   SendsWater(f, a))))) & (forall a (forall f (forall b (PoursInto(a) ->   SendsWater(f, b))))) & (forall f (forall b (  PoursInto(b) ->   SendsWater(f, b))))) -> (PoursInto(a) and PoursInto(b))","(exists c (exists b (exists e (exists f (exists a (exists d (HasCreptUp(c) and (IsHighTide(d) and IsBriskWind(e) and (SendsWater(f,a) and SendsWater(f,b))))))))) & (forall i (forall h (forall j (PoursInto(h) ->   SendsWater(i,j))))) & (forall l (forall k (forall m (  PoursInto(k) ->   SendsWater(l,m))))) & (forall p (forall o (forall n (PoursInto(n) ->   SendsWater(o,p))))) & (forall r (forall q (forall s (  PoursInto(q) ->   SendsWater(r,s)))))) -> (exists a (exists b (PoursInto(a) and PoursInto(b))))",LF
89,intentional,0,The international team onboard the Russian research ship R/V Akademik Keldysh said most of the bubbles were currently dissolving in the water but methane levels at the surface were four to eight times what would normally be expected and this was venting into the atmosphere ., Methane levels at the surface were four to eight times what would normally be expected., Methane is venting into the atmosphere.,AtSurface(a),"IsVentingInto(c, d)",[],[],"[(' Methane levels', ' Methane'), (' Methane levels', ' atmosphere')]",AtSurface(a),"IsVentingInto(c, d)","(exists a (AtSurface(a))) -> (forall d (forall c (IsVentingInto(c, d))))","(exists a (AtSurface(a))) -> (exists c (exists d (IsVentingInto(c, d))))",LF
90,intentional,0,"While it 's too soon to say precisely how global warming may have affected the rare confluence of events that conspired to dump at least 26.88 inches of rain in less than four days on South Carolina , changes in extreme precipitation events are one of global warming 's most well-documented climate change impacts .", Changes in extreme precipitation events are one of global warming's most well-documented climate change impacts., Global warming may have affected the confluence of events that caused heavy rain in South Carolina.,"IsExtreme(b),  IsImpactOfClimateChange(c)","Affected(a, d),  CausedHeavyRain(d, e),  IsIn(f, e)","[('IsExtreme(b)', '  CausedHeavyRain(d, e)'), ('  CausedHeavyRain(d, e)', 'IsExtreme(b)'), ('  IsImpactOfClimateChange(c)', 'Affected(a, d)'), ('Affected(a, d)', '  IsImpactOfClimateChange(c)')]","[("" global warming's"", ' Global warming')]","[(' Extreme precipitation events', ' heavy rain'), (' climate change impacts', ' Global warming'), (' climate change impacts', ' heavy rain'), (' climate change impacts', ' South Carolina')]",IsExtreme(b) and IsImpactOfClimateChange(c),"Affected(a, d) and CausedHeavyRain(d, e) and IsIn(f, e)","(exists c (exists b (IsExtreme(b) and IsImpactOfClimateChange(c))) & (forall e (forall d (forall b (IsExtreme(b) ->   CausedHeavyRain(d, e))))) & (forall e (forall d (forall b (  CausedHeavyRain(d, e) -> IsExtreme(b))))) & (forall a (forall c (forall d (  IsImpactOfClimateChange(c) -> Affected(a, d))))) & (forall a (forall c (forall d (Affected(a, d) ->   IsImpactOfClimateChange(c)))))) -> (forall f (forall a (forall e (Affected(a, d) and CausedHeavyRain(d, e) and IsIn(f, e)))))","(exists c (exists b (IsExtreme(b) and IsImpactOfClimateChange(c))) & (forall i (forall h (forall j (IsExtreme(h) ->   CausedHeavyRain(i,j))))) & (forall l (forall k (forall m (  CausedHeavyRain(k,l) -> IsExtreme(m))))) & (forall p (forall o (forall n (  IsImpactOfClimateChange(n) -> Affected(o,p))))) & (forall r (forall q (forall s (Affected(q,r) ->   IsImpactOfClimateChange(s)))))) -> (exists e (exists a (exists f (exists d (Affected(a, d) and CausedHeavyRain(d, e) and IsIn(f, e))))))",LF
91,false causality,0,Any increase in flooding activity is due to human alterations of river and stream flow rather than precipitation changes ., Any increase in flooding activity is due to human alterations of river and stream flow.  , Precipitation changes do not cause an increase in flooding activity.,"IsIncreaseInFloodingActivity(a),  IsDueTo(b),  AltersRiverFlow(b,c),  AltersStreamFlow(b,d)","CauseIncreaseInFloodingActivity(e,f)","[('IsIncreaseInFloodingActivity(a)', 'CauseIncreaseInFloodingActivity(e,f)'), ('CauseIncreaseInFloodingActivity(e,f)', 'IsIncreaseInFloodingActivity(a)')]",[],"[(' Increase in flooding activity', ' Precipitation changes'), (' Increase in flooding activity', ' flooding activity')]","IsIncreaseInFloodingActivity(a) and (IsDueTo(b) and AltersRiverFlow(b,c) and AltersStreamFlow(b,d))","~CauseIncreaseInFloodingActivity(e,f)","(exists a (IsIncreaseInFloodingActivity(a) and (IsDueTo(b) and AltersRiverFlow(b,c) and AltersStreamFlow(b,d))) & (forall a (forall f (forall e (IsIncreaseInFloodingActivity(a) -> CauseIncreaseInFloodingActivity(e,f))))) & (forall e (forall f (forall a (CauseIncreaseInFloodingActivity(e,f) -> IsIncreaseInFloodingActivity(a)))))) -> (forall f (forall e (~CauseIncreaseInFloodingActivity(e,f))))","(exists a (exists c (exists d (exists b (IsIncreaseInFloodingActivity(a) and (IsDueTo(b) and AltersRiverFlow(b,c) and AltersStreamFlow(b,d)))))) & (forall i (forall h (forall g (IsIncreaseInFloodingActivity(g) -> CauseIncreaseInFloodingActivity(h,i))))) & (forall j (forall l (forall k (CauseIncreaseInFloodingActivity(j,k) -> IsIncreaseInFloodingActivity(l)))))) -> (exists e (exists f (~CauseIncreaseInFloodingActivity(e,f))))",LF
92,faulty generalization,0,"Still , the shift is precisely what he and other cyclone experts said would be expected from climate change .", Cyclone experts predicted a shift due to climate change., Climate change causes the shift.,"PredictedShiftDueTo(b, a)","Causes(a, c)",[],"[(' climate change', ' Climate change')]",[],"PredictedShiftDueTo(b, a)","Causes(a, c)","(PredictedShiftDueTo(b, a)) -> (Causes(a, c))","(exists a (exists b (PredictedShiftDueTo(b, a)))) -> (exists a (exists c (Causes(a, c))))",LF
93,appeal to emotion,0,“ This has been the saddest research trip of my life ”," ""This research trip has been the saddest of my life.""  "," ""This research trip has been extremely disappointing.""","IsResearchTrip(a),  IsSaddestOf(b, a)","IsResearchTrip(a),  IsExtremelyDisappointing(a)",[],"[(' This research trip', ' This research trip')]",[],"IsResearchTrip(a) and IsSaddestOf(b, a)",IsResearchTrip(a) and IsExtremelyDisappointing(a),"(IsResearchTrip(a) and IsSaddestOf(b, a)) -> (IsResearchTrip(a) and IsExtremelyDisappointing(a))","(exists a (exists b (IsResearchTrip(a) and IsSaddestOf(b, a)))) -> (exists a (IsResearchTrip(a) and IsExtremelyDisappointing(a)))",LF
94,fallacy of logic,0,Eight countries control land in the Arctic Circle . Five have coastlines to defend . The temperature is rising . The ice is melting . The race for newly accessible resources is beginning . And Russia is gaining ground ., Eight countries control land in the Arctic Circle. Five countries have coastlines to defend. The temperature is rising. The ice is melting. The race for newly accessible resources is beginning. Russia is gaining ground., Russia is gaining an advantage in the Arctic Circle race for resources.,"ControlLandIn(c, a),  HaveCoastlines(e),  IsRising(g),  IsMelting(h),  IsBeginning(j),  IsGainingGround(b)","IsGainingAdvantage(b),  IsInArcticCircleRace(b),  IsForResources(b)","[('  IsGainingGround(b)', 'IsGainingAdvantage(b)'), ('IsGainingAdvantage(b)', '  IsGainingGround(b)'), ('  IsInArcticCircleRace(b)', '  IsGainingGround(b)'), ('  IsGainingGround(b)', '  IsForResources(b)')]","[(' the Arctic Circle', ' Arctic Circle'), (' Russia', ' Russia'), (' resources', ' Russia')]","[(' land', ' Russia'), (' the Arctic Circle', ' Russia'), (' coastlines', ' Russia'), (' newly accessible resources', ' resources')]","ControlLandIn(c, a) and HaveCoastlines(e) and IsRising(g) and IsMelting(h) and IsBeginning(j) and IsGainingGround(b)",IsGainingAdvantage(b) and IsInArcticCircleRace(b) and IsForResources(b),"(exists a (ControlLandIn(c, a) and HaveCoastlines(e) and IsRising(g) and IsMelting(h) and IsBeginning(j) and IsGainingGround(b)) & (forall b (  IsGainingGround(b) -> IsGainingAdvantage(b))) & (forall b (IsGainingAdvantage(b) ->   IsGainingGround(b))) & (forall b (  IsInArcticCircleRace(b) ->   IsGainingGround(b))) & (forall b (  IsGainingGround(b) ->   IsForResources(b)))) -> (forall b (IsGainingAdvantage(b) and IsInArcticCircleRace(b) and IsForResources(b)))","(exists c (exists b (exists j (exists e (exists g (exists h (exists a (ControlLandIn(c, a) and HaveCoastlines(e) and IsRising(g) and IsMelting(h) and IsBeginning(j) and IsGainingGround(b)))))))) & (forall m (  IsGainingGround(m) -> IsGainingAdvantage(m))) & (forall n (IsGainingAdvantage(n) ->   IsGainingGround(n))) & (forall o (  IsInArcticCircleRace(o) ->   IsGainingGround(o))) & (forall p (  IsGainingGround(p) ->   IsForResources(p)))) -> (exists b (IsGainingAdvantage(b) and IsInArcticCircleRace(b) and IsForResources(b)))",LF
95,intentional,0,You ’ ve only got to look at Singapore ., Singapore is an example to look at.  , Singapore serves as evidence.,IsExample(a),IsEvidence(a),"[('IsExample(a)', 'IsEvidence(a)'), ('IsEvidence(a)', 'IsExample(a)')]","[(' Singapore', ' Singapore')]",[],IsExample(a),IsEvidence(a),(IsExample(a) & (forall a (IsExample(a) -> IsEvidence(a))) & (forall a (IsEvidence(a) -> IsExample(a)))) -> (IsEvidence(a)),(exists a (IsExample(a)) & (forall c (IsExample(c) -> IsEvidence(c))) & (forall d (IsEvidence(d) -> IsExample(d)))) -> (exists a (IsEvidence(a))),Valid
